id,display_name,full_name,status,role_tags,primary_circle,first_appearance,alive_in_story,age_in_2026,notes
brian_eno,Brian,Brian Peter George St John le Baptiste de la Salle Eno,real,producer;musician,industry,,true,77,Producer/ambient pioneer; corresponds with Homer on sound theory; letters relationship
daniel_lanois,Daniel,Daniel Lanois,real,producer,industry,,true,73,Producer; ongoing contact with Homer; U2/Dylan records
t_bone_burnett,T Bone,Joseph Henry Burnett,real,producer;musician,industry,,true,76,Producer; ongoing contact with Homer; Nashville/Americana world
irving_azoff,Irving,Irving Azoff,real,manager;executive,industry,,true,76,Industry manager; calling Eleanor about Alex post-graduation; Eagles/Eagles management
princess_maria_olympia,Maria-Olympia,Princess Maria-Olympia of Greece and Denmark,real,royalty;model,summer_house,,true,29,Greek/Danish royal; Summer House Young Royals tier; fashion world
princess_alexia,Alexia,Princess Alexia of the Netherlands,real,royalty,summer_house,,true,19,Dutch royal family; Summer House Young Royals tier
achileas_of_greece,Achileas,Prince Achileas-Andreas of Greece and Denmark,real,royalty,la_terrazza,,true,24,Greek/Danish royal; Summer House Young Royals; Mediterranean circuit; Greco-British royal ties
kate_moss,Kate,Katherine Ann Moss,real,model;circle_member,phoenix_hollow,,true,51,Supermodel; Lila's mother; Phoenix Hollow legacy parent tier
madonna,Madonna,Madonna Louise Ciccone,real,musician;circle_member,phoenix_hollow,,true,67,Pop icon; Phoenix Hollow legacy parent tier; Rocco's mother
jude_law,Jude,David Jude Heyworth Law,real,actor;circle_member,phoenix_hollow,,true,52,Actor; Phoenix Hollow legacy parent tier; Iris's father
tyrone_lebon,Tyrone,Tyrone Lebon,real,photographer;editorial;fashion_adjacent,summer_house,,true,37,British editorial photographer; Dior Men/Miu Miu/Bottega clients; London and Milan circuit
cass_bird,Cass,Cass Bird,real,photographer;editorial;portrait,summer_house,,true,46,American portrait/editorial photographer; Vogue/GQ/Dior/Saint Laurent clients; NY and European circuit
morgan_maassen,Morgan,Morgan Maassen,real,photographer;surf;lifestyle,summer_house,,true,32,Surf and lifestyle photographer/filmmaker; Vogue crossover; seasonal Ibiza/Sardinia presence
campbell_addy,Campbell,Campbell Addy,real,photographer;editorial;filmmaker,summer_house,,true,31,British-Ghanaian photographer and filmmaker; Valentino/Bottega/Burberry clients; London crossover
ibrahim_kamara,Ibrahim,Ibrahim Kamara,real,creative_director;editorial;fashion,summer_house,,true,34,Sierra Leonean-British creative director; Editor-in-Chief Dazed; Prada/Valentino collaborations
lotta_volkova,Lotta,Lotta Volkova,real,stylist;creative_director,summer_house,,true,42,Russian-born stylist/creative director; independent; Paris-based; European summer circuit
dovile_drizyte,Dovile,Dovile Drizyte,real,casting_director;fashion_industry,summer_house,,true,38,Lithuanian casting director; Prada/Miu Miu/McQueen campaigns; invisible infrastructure
etienne_moreau,Étienne,Étienne Moreau,fictional_supporting,chef,hatfield_nyc,,true,42,Executive Chef at The Stave NYC (Tribeca); French-trained (Le Cordon Bleu; staged at Pierre Gagnaire Paris; CDC at Daniel before Hatfield recruited him 2022); runs The Stave NYC kitchen and oversees private dining at West 71st when Alex hosts; quiet professional; Alex knows him well
princess_isabella_savoy,Princess Isabella,HRH Princess Isabella Maria Teresa of Savoy-Aosta,fictional_supporting,royal;deceased,family,,false,,"Alex's maternal great-grandmother (Richard Dawson's mother); Italian royal, cadet branch of House of Savoy-Aosta; born Turin 1918; came to London during WWII; married Archibald Dawson 6th Earl of Fletching 1945; died 2005; gave the Fletching line direct Italian royal descent"
prince_ludovico_savoy,Prince Ludovico,HRH Prince Ludovico of Savoy-Aosta,fictional_supporting,royal;deceased,family,,false,,"Alex's maternal great-great-grandfather; fictional cadet of Savoy-Aosta branch; father of Princess Isabella; born 1888 died 1960; remained in Italy through the house's deposition 1946"
princess_anastasia_greece,Princess Anastasia,HRH Princess Anastasia Sophia of Greece and Denmark,fictional_supporting,royal;deceased,family,,false,,"Alex's maternal great-grandmother (Margaret Dawson's mother); Greek royal, cadet branch of House of Glücksburg; born Athens 1924; evacuated to London 1941 after German invasion of Greece; married General Sir Edward Whitelock 1948; died 2001; gave Margaret direct Greek royal descent and connects the family to the Mountbatten/Windsor cousin web via Prince Philip's Greek-royal lineage"
edward_whitelock,Sir Edward,General Sir Edward Whitelock GCB MC,fictional_supporting,military;deceased,family,,false,,"Alex's maternal great-grandfather (Margaret Dawson's father); British Army officer; served North Africa and Italy WWII; knighted 1962; married Princess Anastasia of Greece and Denmark 1948; died 1998; father of Margaret Whitelock who became Countess of Fletching on marriage to 7th Earl"
